id,created_at,text,retweets,favorites
257774827790807040,2012-10-15 09:28:02,"b'Once you have a genuine sense of concern for others, there\xe2\x80\x99s no room for cheating, bullying or exploitation.'",13403,3678
257408884791185408,2012-10-14 09:13:55,b'Live: Global conversation and Q&amp;A with HHDL \xe2\x80\x98Ethics for a Prosperous World\xe2\x80\x99 Oct 23. Info at http://t.co/ByPzFgcI #askDalaiLama @LegatumInst',548,184
256686864143101952,2012-10-12 09:24:52,"b""Peace isn't the mere absence of violence; peace must come from inner peace. And inner peace comes from taking others\xe2\x80\x99 interests into account""",11172,2788
255961762141184001,2012-10-10 09:23:34,"b'HHDL shaking hands with Dave Matthews onstage at the One World Concert held in Syracuse, NY, USA, on October 9th.  http://t.co/gBoqDWnd'",2745,2060
255239038842331136,2012-10-08 09:31:43,b'Warm-heartedness and concern for others are a part of human nature and are at the core of positive human values.',10687,2716
254876646425907200,2012-10-07 09:31:42,"b""Live Webcasts: HHDL's visit to the USA - talks and discussions from New York, Virginia and Vermont on October 8-13. http://t.co/cUt5qBa8""",514,199
253063644252868608,2012-10-02 09:27:29,"b'A happy society must be created by people themselves, not through prayer alone, but by taking action.'",10733,2590
251614277641838593,2012-09-28 09:28:13,"b'Live Webcasts: HHDL\'s teachings on Atisha\'s ""Lamp for the Path to Enlightenment"" from Dharamsala, India on October 1-4 http://t.co/BbUVClpE'",520,249
251252400193687552,2012-09-27 09:30:14,b'I like to point out that our nature is basically compassionate because we are social animals. What brings us together is love and affection.',7522,1972
250164581186560000,2012-09-24 09:27:38,"b'The very purpose of spirituality is self-discipline. Rather than criticizing others, we should evaluate and criticize ourselves.'",13957,4442
249077613128208384,2012-09-21 09:28:25,"b'We need to understand how destructive emotions affect us and constructive emotions can help us, so that we can maintain our peace of mind.'",15438,4269
248352694274772992,2012-09-19 09:27:51,"b'In order to lead a meaningful life, you need to cherish others, pay attention to human values and try to cultivate inner peace.'",15837,4160
247627923333464064,2012-09-17 09:27:52,b'Training the mind is the source of inner peace.\xe2\x80\x9d',7621,2266
246539825627402240,2012-09-14 09:24:09,"b'A real sense of concern for others breeds trust, which in turn leads to friendship and a sense of security.'",6200,1785
245816188389707776,2012-09-12 09:28:41,b'Compassion and peace of mind bring a sense of confidence that reduce stress and anxiety.',9787,2779
245090097467383809,2012-09-10 09:23:27,"b'When we are caught up in a destructive emotion, we lose one of our greatest assets: our independence.'",11332,3647
244003507286454272,2012-09-07 09:25:44,b'Improvement requires continuous effort.',14867,3804
243278261910638592,2012-09-05 09:23:52,"b""Many of our world's problems and conflicts arise because we have lost sight of the basic humanity that binds us together as a human family.""",11544,2528
242195829585215488,2012-09-02 09:42:40,"b'Live: HHDL teaches on Shantideva\'s ""A Guide to the Bodhisattva\'s Way of Life"" from Dharamsala, India, September 4-6 http://t.co/BbUVClpE'",577,285
241467824072175616,2012-08-31 09:29:50,b'We need to understand that material development by itself it doesn\xe2\x80\x99t bring peace of mind. This can only be developed within the mind.',5627,1328
240018589694980096,2012-08-27 09:31:05,"b'Since universal compassion involves gradually expanding one\xe2\x80\x99s circle of concern to the whole of humanity, it needs constant cultivation.'",4918,1209
238931335715106816,2012-08-24 09:30:44,b'The best way of fulfilling your own interest is to take care of others.',8573,2121
237481569810518016,2012-08-20 09:29:53,b'I have found that the greatest degree of inner peace comes from cultivating love and compassion.',9262,2505
236414194931621888,2012-08-17 10:48:31,"b'We have to find ways to encourage non-violence, compassion and respect for others\xe2\x80\x99 rights to achieve a better world in the future.'",8104,1524
235671222061510656,2012-08-15 09:36:12,b'When I wake in the morning I make a wish to be useful to others.',8071,2774
234944328420687873,2012-08-13 09:27:47,b'We need an approach to ethics which makes no recourse to religion and can be equally acceptable to those with faith and those without.',10455,2772
233855526985949185,2012-08-10 09:21:17,"b""When we develop a sense of concern for others' well-being then the very basis of anger is no longer there.""",8047,2237
233134098758135808,2012-08-08 09:34:35,"b'I have made a commitment to work until I die to raise awareness that the source of happiness, warm-heartedness, lies within us.'",7011,2533
232407441323741185,2012-08-06 09:27:06,"b'Affection is important because it counters anger, hatred and suspicion that can prevent our minds from functioning clearly.'",11208,2984
231319322239328257,2012-08-03 09:23:18,"b'HHDL speaks about the oneness of humanity in this clip from his talk in Inverness, Scotland, given on June 23, 2012. http://t.co/q6Rcs2wH'",704,330
230597018043682816,2012-08-01 09:33:08,"b'Who is there among us who does not prefer tolerance, respect and forgiveness of our failings to bigotry, disrespect, and resentment?'",7097,1688
229877332968632320,2012-07-30 09:53:21,"b""Don't blame others for your uneasy feelings; blame your own state of mind. This is why altruism \xc2\xa0brings you greater peace of mind.""",10405,3243
228784383358799873,2012-07-27 09:30:22,"b'Whatever you do, take a realistic view and think of the long term interests of humanity.'",6372,1633
228059585553002496,2012-07-25 09:30:16,b'More important than being loved is to love.',19374,4938
227333505246437377,2012-07-23 09:25:05,b'It is important for us to examine our motivation in our day to day life.',7808,2062
226247614843203584,2012-07-20 09:30:09,"b'We have the source of contentment and happiness within ourselves, and it is related to nurturing our natural inner values.'",5565,1475
225523600189427714,2012-07-18 09:33:10,"b'Understanding the advantages and drawbacks of particular emotions and applying our intelligence, we can transform our minds.'",6281,1799
224797477663014912,2012-07-16 09:27:49,b'People in every part of the world are fed up with violence; increasingly people are looking for ways to create peace.',5302,1155
223709810472927232,2012-07-13 09:25:49,"b'A calm mind is good for our physical health, but it also enables us to see things more realistically.'",12562,2999
222978874286419969,2012-07-11 09:01:21,"b'We need to relate to each other out of compassion, with a sense of connection to each other and a deep recognition of our common humanity.'",7576,1720
222258734062256128,2012-07-09 09:19:46,b'A good way to work for a more peaceful world is to develop concern for others.',6662,1404
221177523164282881,2012-07-06 09:43:25,b'HHDL is greeted by well-wishers as he arrives for celebrations honoring his 77th birthday in Dharamsala on July 6  http://t.co/NbkyQUJq',1207,729
220811437323452416,2012-07-05 09:28:43,"b""Live Webcast: HHDL's 77th Birthday Celebrations from the Main Tibetan Temple in Dharamsala, India on July 6th.. http://t.co/V0p2Ho9o""",630,178
220448287331852288,2012-07-04 09:25:42,b'Anger destroys our peace of mind and our physical health. We shouldn\xe2\x80\x99t welcome it or think of it as natural or as a friend.',13506,3712
219723388682379266,2012-07-02 09:25:12,b'Kindness and a good heart are the underlying foundation for success in this life and making progress on the spiritual path.',10383,2679
217910596438466560,2012-06-27 09:21:49,b'Altruism is not merely a religious ideal; it is an indispensable requirement for humanity at large.',4673,1021
217551360613302273,2012-06-26 09:34:20,"b""Live Webcasts: HHDL's teachings and talk from Milan, Italy, on June 27-28. English, Italian &amp; Russian languages. http://t.co/BbUVClpE""",452,143
217188907874398208,2012-06-25 09:34:05,b'Through constant training we can enhance our positive attitudes and thoughts and reduce their opposing negative attitudes.',7765,1936
216829800172625920,2012-06-24 09:47:07,"b'HHDL greeting a young fan on his arrival in Inverness, Scotland, on June 23.                                       http://t.co/7KP5BhlC'",1057,930
216099263946563584,2012-06-22 09:24:14,"b'A genuine change must first come from within the individual, only then can he or she attempt to make a significant contribution to humanity.'",9095,2290
215739874119135232,2012-06-21 09:36:08,"b""HHDL with Britain's Prince Charles at Clarence House in London, England, on June 20th.                             http://t.co/32SUhT5a""",1054,853
215359822315520001,2012-06-20 08:25:57,"b'His Holiness the Dalai Lama with Aung San Suu Kyi during their private meeting in London, England, on June 19th.   http://t.co/GxRRRlUI'",2138,1032
214649025603969024,2012-06-18 09:21:30,"b'If you conduct your life on the basis of truth and honesty, it gives you a sense of satisfaction and self-confidence.'",12086,2963
214290062433726465,2012-06-17 09:35:06,"b'HHDL in a playful mood with comedian Russell Brand in during an event for young people in Manchester, UK, June 16. http://t.co/yWBfOdnG'",3411,2163
213570679281430528,2012-06-15 09:56:32,"b""Today's children are hugely important, our hopes for the future lie in their hands and rest on their shoulders.""",4729,929
213201569313865728,2012-06-14 09:29:49,"b""Live Webcasts: HHDL's talks and teachings live from Manchester, England, June 16th-18th. http://t.co/Ipn0mbAj""",373,123
212834857208905729,2012-06-13 09:12:38,b'I am increasingly convinced that the time has come to find a way of thinking about spirituality and ethics beyond religion altogether.',15979,4629
212112889803317248,2012-06-11 09:23:48,"b'When, from the depths of your heart, you spontaneously wish all beings to find true, lasting happiness, this is great love.'",8586,2490
211027278887534592,2012-06-08 09:29:58,"b'To be extremely self-centred, only interested in your own satisfaction, always brings negative consequences in the long run.'",10057,2199
210304080826998784,2012-06-06 09:36:14,"b'The sole source of peace in families, countries and the world is\naltruism \xe2\x80\x93 love and compassion.'",5206,1127
209938938234802176,2012-06-05 09:25:18,"b'HHDL talks about realistic compassion in a clip from his talk given at the University of Hawaii on April 15, 2012. http://t.co/dD7y7w9d'",464,216
209596183302246401,2012-06-04 10:43:18,"b""Live Webcasts: HHDL's Introductory Buddhist Teachings from the Main Tibetan Temple in Dharamsala, India, on June 7-9. http://t.co/cUt5qBa8""",529,243
208491157523660801,2012-06-01 09:32:20,"b'Warm-heartedness reinforces our self-confidence \xe2\x80\x93 giving us not a blind confidence, but a sense of confidence based on reason.'",5587,1372
207766244852641792,2012-05-30 09:31:47,"b'Live Webcasts: HHDL introductory teachings on Buddhism for young Tibetans from TCV in Dharamsala, India, June 1-3. http://t.co/cUt5qBa8'",354,159
207402953378766848,2012-05-29 09:28:12,b'The many factors which divide us are actually much more superficial than those we share.',6719,1413
207044899328110592,2012-05-28 09:45:25,"b""HHDL attending Mass at St. Stephen's Cathedral in Vienna, Austria, on May 27th.                                    http://t.co/Bhhszp2j""",766,637
206683081518743552,2012-05-27 09:47:41,"b'HHDL speaking at the European Solidarity Rally for Tibet at the Vienna Heldenplatz in Vienna, Austria, on May 26.  http://t.co/PJAiWjlp'",665,427
205957601031241728,2012-05-25 09:44:53,b'Cultivating inner discipline is something that takes time; expecting rapid results is simply a sign of impatience.',7791,2255
205230417291378691,2012-05-23 09:35:19,"b'The ultimate source of happiness is not money and power, but warm-heartedness.'",11626,2616
204870792629063680,2012-05-22 09:46:17,"b'HHDL greeting well-wishers waiting outside the Salzburg Arena before his talk in Salzburg, Austria, on May 21st.   http://t.co/XuHycbUZ'",542,397
204504995087921153,2012-05-21 09:32:45,b'Genuine friendship depends on genuine affection and taking a sense of responsibility for each other.',11979,2968
203780720324378624,2012-05-19 09:34:44,"b'HHDL will speak at the European Solidarity Rally for Tibet in Vienna, Austria, on May 26th. http://t.co/gwSO5tfo'",393,93
203417503207137280,2012-05-18 09:31:26,"b'Human values like democracy, freedom of speech and freedom of the individual, these are changes whose momentum cannot be stopped.'",4531,895
203058757184401409,2012-05-17 09:45:55,"b'HHDL on CNN\xe2\x80\x99s Piers Morgan Tonight originally broadcast on April 25, 2012. http://t.co/PhHUsG0g'",421,190
202693063804596225,2012-05-16 09:32:46,"b'The quality of everything we do: our physical actions, our verbal actions, and even our mental actions, depends on our motivation.'",9735,2360
202332674248032256,2012-05-15 09:40:43,b'Dr. John M. Templeton Jr. presents the 2012 Templeton Prize to HHDL at St. Paul\xe2\x80\x99s Cathedral in London on May 14th. http://t.co/PohO0O2o',499,258
201966303358107648,2012-05-14 09:24:53,"b'Unlike the body, when it comes to training the mind, there is no limit to how far we can go.'",10411,2646
201233678712569856,2012-05-12 08:53:42,"b""Live Webcast: 2012 Templeton Prize will be awarded to HHDL at St. Paul's Cathedral in London, UK, on May 14 http://t.co/LenGJAM6 #TempPrize""",371,91
200878177244037120,2012-05-11 09:21:04,"b'Patience guards us against losing our presence of mind so we can remain undisturbed, even when the situation is really difficult.'",9092,2512
200166913937121280,2012-05-09 10:14:45,b'Actively promoting the positive inner qualities of the human heart will be appreciated by all.',4412,897
199432582805454848,2012-05-07 09:36:47,"b'Once you realize that compassion is useful, that it is something really worthwhile, you immediately develop a willingness to cultivate it.'",6721,1410
197618241340850176,2012-05-02 09:27:14,"b'Even our personal virtues, such as patience and our sense of ethics, are all developed in dependence upon others.'",4086,887
196893535063126016,2012-04-30 09:27:31,"b'Fear, hatred, and suspicion narrow your mind \xe2\x80\x93 compassion opens it.'",11844,2639
195805964383961088,2012-04-27 09:25:54,"b'Whenever I meet someone I try to look for their positive qualities, which immediately gives me a feeling of connectedness with them.'",8496,2726
195452392177799168,2012-04-26 10:00:56,b'Just as we need good physical health  we also need strength of mind to \nensure our well-being; and we develop it by cultivating ethics.',6033,1122
194356731785134081,2012-04-23 09:27:10,"b'As individuals and nations become increasingly interdependent, we have no choice but to develop a sense of universal responsibility.'",4555,956
194006059516559360,2012-04-22 10:13:43,"b'Live Webcasts with HHDL from the Mayo Clinic and 12th World Summit of Nobel Peace Laureates on April 23-25, 2012. http://t.co/BbV09Vqy'",372,100
193656353137496065,2012-04-21 11:04:07,"b'Video of HHDL\xe2\x80\x99s interview for KPBS in San Diego, California, recorded on April 19th, 2012. http://t.co/laWDLF9F'",392,205
193269305104809984,2012-04-20 09:26:07,"b'Live Webcast: HHDL\'s talk ""Peace of Mind in Troubled Times"" from Long Beach, California, on April 21st at 1:30pm PDT.. http://t.co/BbV09Vqy'",477,171
192907526336024577,2012-04-19 09:28:32,"b'If you become more concerned for the welfare of others, you will experience a sense of calm, inner strength and self-confidence.'",8285,1914
192545596010266624,2012-04-18 09:30:22,b'HHDL talks about the importance of inner values in this clip from his talk at the University of Hawaii on April 14th. http://t.co/1VVcDTxZ',493,199
192187644556484608,2012-04-17 09:47:59,"b'HHDL jokes with members of the voyaging canoe H\xc5\x8dk\xc5\xable\xe2\x80\x98a at Kualoa Regional Park on Oahu, Hawaii, on April 16, 2012. http://t.co/jx1tSY7o'",786,472
191819089407262720,2012-04-16 09:23:29,b'Having a more compassionate attitude helps you communicate more easily with your fellow human beings.',8662,1652
191154505465864192,2012-04-14 13:22:40,b'Short video clip of HHDL being welcomed on his arrival in Hawaii on April 13th. http://t.co/rbpzEzb9',443,142
190737422961750016,2012-04-13 09:45:20,"b'If we are optimistic, take a longer view, and we employ realistic methods, we can contribute to making the world a better place.'",6761,1228
190370861075795968,2012-04-12 09:28:44,"b""Live webcasts of HHDL's public talks and panel discussions from Hawaii and San Diego, USA, from April 14-19. http://t.co/BbV09Vqy""",409,120
190008349302067200,2012-04-11 09:28:15,"b'Unbiased love is undoubtedly difficult to generate, but if you practice\nwith determination, day by day your attitude will be transformed.'",6056,1479
189285979977293825,2012-04-09 09:37:49,"b'As you develop a more compassionate attitude, you feel less anxiety, while your determination and self-confidence increase.'",8542,2204
188195478729539584,2012-04-06 09:24:33,b'I am often asked whether I am optimistic for the future of humanity. My simple answer is yes.',5479,1123
187470054768652288,2012-04-04 09:21:58,b'An inflated sense of self-importance deflects us from the inner peace and happiness we seek and affects those around us negatively.',8278,1820
187113271323664385,2012-04-03 09:44:14,"b'HHDL during his visit to Rewalsar Sahib, a Sikh shrine in Tso Pema (Rewalsar), HP, India on April 3rd, 2012.       http://t.co/thqZf02B'",837,567
185660217357373440,2012-03-30 09:30:19,b'Compassion is a mental quality that can bring us true lasting inner peace and inner strength.',7077,1453
185309979291561985,2012-03-29 10:18:36,"b'HHDL wins the 2012 Templeton Prize, honored for encouraging scientific research and harmony among religions http://t.co/bmWeVQYS #tempprize'",681,149
184939771796258817,2012-03-28 09:47:32,"b'We often talk about moral values, justice and trust, but the important thing is to put them into effect in our everyday lives.'",9964,1667
182040293607088128,2012-03-20 09:46:02,"b'Live Webcast: HHDL\'s public talk ""Ethics - Educating the Mind and Heart"" from Delhi University on March 22nd. http://t.co/Xl8neIyi'",582,208
181679148459237377,2012-03-19 09:50:59,"b""Wealth may contribute to our happiness, but it's not the most important factor; by itself wealth fails to bring us deep inner satisfaction.""",7233,1403
180582388496207872,2012-03-16 09:12:51,"b'On a personal level, we all appreciate people who are kind and warm-hearted.'",6751,1295
179859376813776896,2012-03-14 09:19:51,b'A sense of concern for others gives our lives meaning; it is the root of all human happiness.',10171,2110
179136019659104257,2012-03-12 09:25:29,b'The whole emphasis of our spiritual practice should be aimed at creating positive and healthy thoughts and actions.',7177,1578
178066603223695362,2012-03-09 10:36:01,b'Common sense shows you the value of warmheartedness.',4297,831
177703384059625472,2012-03-08 10:32:42,"b'HHDL during the Jataka Tales teaching held at the Main Tibetan Temple in Dharamsala, India, on March 8th.          http://t.co/hdtql8Le'",604,388
177341204793536513,2012-03-07 10:33:32,"b'The more adept we are in cultivating altruism, the happier we will be and the better the atmosphere we will create around us.'",4322,778
176976418591346688,2012-03-06 10:24:00,"b'Live Webcast: HHDL will teach on the Jataka Tales from the Main Tibetan Temple in Dharamsala, India, on March 8th. http://t.co/BbV09Vqy'",476,155
176614559661047808,2012-03-05 10:26:07,"b'Compassion is a marvel of human nature, a precious inner resource, and the foundation of our well-being and the harmony of our societies.'",6379,1137
175520640038744064,2012-03-02 09:59:16,b'Generosity is the most natural outward expression of an inner attitude of compassion and loving-kindness.',8038,1616
174780920224694272,2012-02-29 08:59:53,b'It is vital that when we educate our children\xe2\x80\x99s brains we do not neglect to educate their hearts by nurturing their compassionate nature.',10214,2020
174069639658217472,2012-02-27 09:53:30,b'The ultimate source of comfort and peace is within ourselves.',9180,1977
172983697405001729,2012-02-24 09:58:22,"b'If we seek happiness for ourselves, we should practice compassion: and if we seek happiness for others, we should also practice compassion.'",6947,1314
172257757007855616,2012-02-22 09:53:44,"b'Traditional Tibetan New Year prayers with HHDL on the Main Tibetan Temple rooftop in Dharamsala, India, on Feb 22. http://t.co/Twi5dLEg'",1048,347
171901290710970368,2012-02-21 10:17:16,"b'We have to put effort into being honest, truthful and compassionate towards others.'",7856,1423
170460250862915584,2012-02-17 10:51:05,"b'Nonviolence is not a sign of weakness, but rather one of self-confidence and courage.'",8889,1937
169727219839676417,2012-02-15 10:18:17,b'Altruism is the spirit out of which we choose to take action and give\nhelp that brings others happiness.',4508,873
169004201349873664,2012-02-13 10:25:16,b'In order to use human intelligence properly our mind should be calm.',8126,1824
167928663516516352,2012-02-10 11:11:28,"b'Archbishop Desmond Tutu and his wife Leah Tutu with HHDL during their visit to Dharamsala, India, on February 10th http://t.co/CSC9PAsC'",783,399
167554074152140800,2012-02-09 10:22:58,"b'Live Webcast: HHDL welcomes Archbishop Desmond Tutu to Dharamsala, India, on February 10 at 10:30-11:30am Indian Time http://t.co/Xl8neIyi'",400,93
167189442254209024,2012-02-08 10:14:03,"b'We can benefit others through our actions by being warm and generous toward them, by being charitable, and by helping those in need.'",7378,1147
166467001865342976,2012-02-06 10:23:20,b'Compassion is the ultimate source of success in life.',9354,1879
165380404415700992,2012-02-03 10:25:35,"b""In today's deeply interdependent world, war is outdated and illogical.""",7149,1306
164292899926835201,2012-01-31 10:24:14,b'We need to teach about warmheartedness in a secular context.',3614,698
163931932718153730,2012-01-30 10:29:53,"b'Cultivating inner awareness, introspection and reasoning can be more effective than meditation and prayer.'",5377,1524
162847601522245632,2012-01-27 10:41:08,b'It is because of my wish to be helpful that I share my ideas and experiences; being helpful to even one person is valuable.',6626,1446
161757451652317184,2012-01-24 10:29:16,"b'So long as we are under the control of disturbing emotions, real happiness is hard to find.'",8844,2145
161392471165775872,2012-01-23 10:18:58,b'The human capacity to care for others isn\xe2\x80\x99t something trivial or something to be taken for granted. Rather it is something we should cherish',8441,1526
160306418904342528,2012-01-20 10:23:23,"b'We all appreciate in others the inner qualities of kindness, patience, tolerance, forgiveness and generosity.'",5609,1149
159943427000254464,2012-01-19 10:20:59,b'Compassion is a true source of happiness.',7111,1385
159217572204658688,2012-01-17 10:16:41,"b'Genuine friendship can only be based on trust and affection, which can only arise when there is a mutual sense of concern and respect.'",13721,3133
158862300432957441,2012-01-16 10:44:58,"b'The key to human happiness lies within our own state of mind, and so too do the primary obstacles to that happiness.'",10263,2184
157763632518803456,2012-01-13 09:59:15,"b'If the twentieth century was a century of violence, let us make the twenty-first a century of dialogue.'",5433,873
156681418062307328,2012-01-10 10:18:55,"b'My hope and wish is that one day, formal education will pay attention to what I call \xe2\x80\x9ceducation of the heart.\xe2\x80\x9d'",6151,1365
156316530957762560,2012-01-09 10:08:59,"b'In our quest for happiness and the avoidance of suffering, I believe we are all fundamentally the same, and therefore equal.'",6004,1202
155605683759349760,2012-01-07 11:04:20,"b'HHDL placing vases around the completed Kalachakra Sand Mandala in Bodh Gaya, India, on January 6, 2012.           http://t.co/LBjchZ4W'",682,386
155240636457566209,2012-01-06 10:53:46,b'The essence of compassion is a desire to alleviate the suffering of others and to promote their well-being.',5759,1266
154869595021389824,2012-01-05 10:19:23,b'HHDL talks about nonviolence at the Mahatma Gandhi International Award for Reconciliation & Peace ceremony on Jan 4. http://t.co/wE0egXSN',485,130
154151370251972608,2012-01-03 10:45:25,"b'While revenge weakens society, forgiveness gives it strength.'",8203,1658
153781232902221824,2012-01-02 10:14:37,b'Our aim in seeking ways of transforming our thoughts and emotions is to find a more wholesome and fulfilling way of living.',4537,1074
153079617077526531,2011-12-31 11:46:39,"b""Live webcasts: HHDL's teachings during Kalachakra for World Peace 2012 from Bodh Gaya, India, on January 1-10. http://t.co/BbV09Vqy""",505,169
152694339821244417,2011-12-30 10:15:42,b'A calm mind is really helpful in sustaining a healthy body.',8395,1954
151607166829207552,2011-12-27 10:15:39,b'To suppose that we can achieve peace through violence is altogether misguided.',6418,1035
151251544979943424,2011-12-26 10:42:33,"b'When we set about cultivating those basic inner values which we all appreciate in others, then we start to live spiritually.'",3935,942
149432234930221057,2011-12-21 10:13:15,"b'Wealth should serve humanity, not vice versa.'",8888,1604
