id,created_at,text,retweets,favorites
1229352320791531520,2020-02-17 10:30:08,"b'The purpose of life is to be happy. This is what all human beings have in common\xe2\x80\x94the wish to lead a happy life. Many think that happiness is to be found outside us in material things, but actually it\xe2\x80\x99s something that comes from within, from warm-heartedness and concern for others'",31016,93699
1228265131269713920,2020-02-14 10:30:02,"b'What we need today are universal values based not on faith but on scientific findings, common experience and common sense.'",15319,55094
1226816111909326848,2020-02-10 10:32:08,"b'When you have a more compassionate mind, everything appears to you in a more positive light. If we employ our human intelligence with warm-heartedness, it creates a happy atmosphere and fosters a happy community.'",15507,53629
1225728752786608129,2020-02-07 10:31:22,"b'Since resentment, anger, and animosity bring us no benefit, it is clearly in our own interest to underpin our attitude to all others with a kind of genuine unconditional and unbiased compassion. And doing so will certainly bring us benefits.'",12082,43901
1224278913750196225,2020-02-03 10:30:13,"b'Peace in the world depends on peace within. If we have that we can approach problems in a spirit of compassion, dialogue and respect for the rights of others\xe2\x80\x94always a better solution than resorting to a use of weapons and force. External disarmament depends on inner disarmament.'",12711,42873
1223192066450026497,2020-01-31 10:31:29,"b'Controlling our desire for more, learning to live within realistic limits, is not only in our own interest. It\xe2\x80\x99s also necessary if we are to overcome the challenges to life on Earth that our incessant quest for more generates\xe2\x80\x94since the material resources of this planet are finite'",10644,36633
1221742203581558785,2020-01-27 10:30:14,"b'Anger and aggression sometimes seem to be protective because they bring energy to bear on a particular situation, but that energy is blind. It takes a calm mind to be able to consider things from different angles and points of view.'",16298,57032
1220655010339418112,2020-01-24 10:30:07,b'I don\xe2\x80\x99t like formality. There\xe2\x80\x99s no formality when we\xe2\x80\x99re born and none when we die. In between we should treat each other as brothers and sisters because we all want to live a happy life. This is our common purpose and our right.',16695,68797
1219567915726327809,2020-01-21 10:30:24,"b'Friendship depends on trust and trust depends on having a strong sense of concern for the welfare of others. Be honest, truthful and warm-hearted. Make compassion the basis of your determination. Think of what the future can be, not what happened in the past.'",22478,68409
1218111219145441280,2020-01-17 10:02:00,"b""HHDL making his way around the Mahabodhi Temple (site of the Buddha's enlightenment) on the final day of his visit to Bodhgaya, Bihar, India on January 17, 2020. (Photo by Tenizn Choejor) https://t.co/kQNHueE8Dc""",1591,11576
1217031164419985408,2020-01-14 10:30:15,"b'Compassion enhances our self-confidence because a calm mind allows our marvellous human intelligence to bloom. When we\xe2\x80\x99re angry, our thinking is distorted and we don\xe2\x80\x99t see the different aspects of reality. A calm mind enables us to take a broader, more realistic view.'",17603,55368
1214132094646935552,2020-01-06 10:30:23,"b'As human beings, all 7 billion of us are born the same way and die the same way. Physically, mentally and emotionally we are the same. We all want to live a happy life and avoid problems, but in a materialistic culture we overlook the importance of love and affection.'",29201,102435
1212682545550131201,2020-01-02 10:30:24,"b'Students from Maitreya School chanting the ""Heart Sutra"" in Sanskrit at the start of HHDL\'s teaching at the Kalachakra Teaching Ground in Bodhgaya, Bihar, India on January 2, 2020. (Photo by Tenzin Choejor) https://t.co/U7549RqzMj'",1374,9704
1212323848177115137,2020-01-01 10:45:03,"b""Time\xe2\x80\x99s always moving on. Nothing can stop it. The question is whether we use our time well or not. We can't do anything about the past, but what happens in the future depends on what we do now. We can create a happier future by remembering that in being human we are all the same.""",34881,105236
1211595594386399234,2019-12-30 10:31:14,"b'Developing compassion you feel much happier within\xe2\x80\x94more calm, more peaceful\xe2\x80\x94and other people respond to that. Through anger, real peace, friendship, and trust are impossible, but through love we can develop understanding, unity, friendship, and harmony \xe2\x80\x94 this is valuable.'",12494,42658
1210508131190444033,2019-12-27 10:30:03,"b'Inter-religious harmony is essential, because each of our religious traditions gives its followers a sense of how to lead a meaningful life. The important thing is to make religion relevant to our daily life rather than simply maintaining old traditions.'",9826,40016
1209054832310415360,2019-12-23 10:15:09,"b'I believe that if we make an effort to develop peace of mind within ourselves and cultivate a proper appreciation of the oneness of humanity, we can create a happier, more peaceful world. What we need is common sense\xe2\x80\x94the positive use of intelligence\xe2\x80\x94and warm-heartedness.'",16681,55250
1207971422015868929,2019-12-20 10:30:04,b'I believe all 7 billion human beings alive today are part of one human family. We are born and die in the same way. And what is most precious in our relations with others is warm-heartedness. It yields the peace of mind and inner strength that are fundamental to a happy community',20701,79415
1206554277147136001,2019-12-16 12:38:51,b'I try to share with other people that the ultimate source of happiness is within us; it\xe2\x80\x99s not found in money and fame. I promote fundamental human values on the basis of scientific findings and common sense. Evidence that basic human nature is compassionate is a source of hope.',15518,55813
1202535644620214272,2019-12-05 10:30:14,"b'Taking care of our planet, is a matter of looking after our own home. We can no longer exploit the earth\xe2\x80\x99s resources\xe2\x80\x94the trees, water, air and minerals\xe2\x80\x94with no care for the coming generations. I support young people\xe2\x80\x99s protests at governments\xe2\x80\x99 inaction over the climate crisis.'",25742,88424
1201448447829659648,2019-12-02 10:30:06,"b'A source of trouble is that our minds are unruly. We need to effect an inner transformation, to understand that love and affection are a real source of joy. It\xe2\x80\x99s important to be warm-hearted rather than selfish. We\xe2\x80\x99ll be less sick, live longer and have more friends here and now.'",11611,40162
1200365042320826368,2019-11-29 10:45:02,"b'Developing concern for others, thinking of them as part of \xe2\x80\x98us\xe2\x80\x99, brings self-confidence, reduces our sense of suspicion and mistrust, and enables us to develop a calm mind. This is important, because a calm mind can help us better cope with physical discomfort and other problems.'",12526,44031
1198911735278604288,2019-11-25 10:30:07,"b'There is an urgent need for India\xe2\x80\x99s traditions of non-violence and compassion in today\xe2\x80\x99s world, which is still riven\xc2\xa0 by fighting and killing, sometimes even in the name of religion. We have the potential from birth to develop inner values like compassion that yield peace of mind'",6419,29309
1197824756231200768,2019-11-22 10:30:51,"b'Time is always moving on, Nothing can stop it. The question is whether we use our time properly or not. We can\xe2\x80\x99t do anything about the past, but what happens in the future depends on what we do now.'",25623,75036
1196375125345652736,2019-11-18 10:30:32,"b'Being too self-centred can give rise to anxiety and depression. An effective antidote is to cultivate a sense of altruism, taking the whole of humanity into account. Appreciating the oneness of humanity leads us to recognise our essential equality as human beings.'",16661,60535
1195287845520302080,2019-11-15 10:30:04,"b'When individuals are too self-centred, they tend to be prone to fear, suspicion, anxiety and anger. Compassion and restraining from harming others, act as an antidote to this. Scientists say that it is basic human nature to be compassionate, because we are social animals.'",16385,55990
1193842622537723906,2019-11-11 10:47:16,"b'Joy and happiness are mental events and, according to our day to day experience, mental satisfaction is superior to physical pleasure. We need material development, but it\xe2\x80\x99s a mistake to depend on material things alone to find happiness. We also need to be warm-hearted.'",14210,49411
1193113624266493952,2019-11-09 10:30:29,"b'HHDL eating prasad\xe2\x80\x94blessed food\xe2\x80\x94that is offered to pilgrims as they leave the Golden Temple at the centre of the Harmandir Sahib, the Sikhs\xe2\x80\x99 holiest temple, in Amritsar, Punjab on November 9, 2019. Photo by Tenzin Choejor https://t.co/jeiCocrOdy'",2102,15642
1191287299738202118,2019-11-04 09:33:19,"b'Anger, suspicion and jealousy disturb our minds. The antidote to these emotions is to cultivate patience and tolerance. Who provides us the opportunity to develop it? The one we call our enemy. Therefore, we can see him or her as a teacher.'",18941,64384
1190202034504421377,2019-11-01 09:40:52,"b'Tackling destructive emotions and practicing loving-kindness is how we should live in the here and now. I am convinced we can become happier individuals, happier communities and a happier humanity by cultivating a warm heart, allowing our better selves to prevail.'",14688,49883
1188749837514051584,2019-10-28 09:30:21,"b""Our modern education systems don't reveal much understanding of how to transform our emotions. To do so, we have to use our intelligence. We need to conduct ourselves with non-violence and on the basis of compassion, cultivate respect for others.""",13800,50488
1187300303579664384,2019-10-24 09:30:26,"b'For me the best introduction is the human face. When I see two eyes, one mouth, one nose, I know I\xe2\x80\x99m dealing with another human being like me. I\xe2\x80\x99m like those young children who don\xe2\x80\x99t care about their companions\xe2\x80\x99 background so long as they smile and are willing to play.'",10117,47786
1186213072676876289,2019-10-21 09:30:09,b'Optimism does not mean being blind to the actual reality of a situation. It means maintaining a positive spirit to continue to seek a solution to any given problem. And it means recognizing that any given situation has many different aspects\xe2\x80\x94positive as well as problematic.',27137,75354
1185126716156436480,2019-10-18 09:33:22,"b'In today\xe2\x80\x99s world, despite ample material development, too many lack inner peace. One way to counter anger, jealousy and competitiveness is to cultivate non-violence and compassion towards others.'",12033,42661
1183676726317965312,2019-10-14 09:31:37,"b""A fundamentally positive approach is to take account of the oneness of humanity. Dividing the world into 'us' and 'them' might have worked in the past, but it doesn't any more. We have to talk through our problems with our opponents, thinking of them as our fellow human beings.""",14065,49186
1181501994185347074,2019-10-08 09:30:01,"b""Every morning when I wake up, I dedicate myself to helping others to find peace of mind. Then, when I meet people, I think of them as long term friends; I don't regard others as strangers.""",11518,61516
1180052498058342405,2019-10-04 09:30:14,"b'As human beings we are all the same. We have this marvellous intelligence, which sometimes creates problems for us, but when influenced by warm-heartedness it can be really creative and helpful. This is the context in which having moral principles is of such great value.'",13256,45771
1178965481580986368,2019-10-01 09:30:49,"b""What\xe2\x80\x99s truly of value in life? what gives our lives meaning? We weren't born to cause trouble or harm. To be of value, we must develop basic good human qualities---warmth, kindness, compassion. Then our life will become happier and more meaningful.""",19192,59044
1176791067590451200,2019-09-25 09:30:28,"b""Mahatma Gandhi's vision of a clean and tidy India has become the vision of millions of Indians who\xe2\x80\x99ve joined #JanAndolan and helped #SwachhBharatMission to unprecedented success. This is not the end but the start of a new journey toward a #plasticfree India &amp; a plastic free world""",3679,19320
1176066197294481408,2019-09-23 09:30:06,"b'If you are motivated by a wish to help on the basis of kindness, compassion and respect, then you can do any kind of work, in any field, and function more effectively with less fear or worry, not being afraid of what others think or whether you will ultimately reach your goal.'",14408,47831
1175720952249769984,2019-09-22 10:38:13,"b'HHDL taking part in a Guru Puja (Feet Cleansing Ceremony) on his arrival at Sri Udasin Karshni Ashram in Mathura, UP, India on September 22, 2019. Photo by Tenzin Choejor https://t.co/oeBBvIZdLr'",852,6785
1175341921402671105,2019-09-21 09:32:05,"b'It\xe2\x80\x99s our responsibility to work with vision, determination and wisdom to create a happier, more peaceful world. We need to take action, while respecting others and their needs, considering all 7 billion human beings alive today as belonging to one human family. #PeaceDayChallenge'",10791,35871
1174979097513955335,2019-09-20 09:30:21,"b""It\xe2\x80\x99s quite right that students and today's younger generation should have serious concerns about the climate crisis and its effect on the environment. They are being very realistic about the future. They see we need to listen to scientists. We should encourage them.""",22638,84410
1173529765472399361,2019-09-16 09:31:13,"b'Our day-to-day existence is very much alive with hope, although there is no guarantee of our future. There is no guarantee that tomorrow at this time we will be here. But still we are working for that purely on the basis of hope. So, we need to make the best use of our time.'",14378,51302
1172442323977850881,2019-09-13 09:30:07,"b'Religion is about cultivating a more peaceful mind, so it\xe2\x80\x99s disappointing if it becomes a source of conflict. Our traditions share a common message of love and compassion, patience and tolerance. If we also remember the advice about forgiveness, there\xe2\x80\x99ll be no basis for conflict.'",14319,46953
1171717559873196037,2019-09-11 09:30:10,"b'Fear and anxiety easily give way to anger and violence. The opposite of fear is trust, which, related to warm-heartedness, boosts our self-confidence. Compassion also reduces fear, reflecting as it does a concern for others\xe2\x80\x99 well-being. This is what really attracts friends.'",14910,49655
1169905593236111361,2019-09-06 09:30:03,"b'As a human being I am committed to trying to share with others that we are social creatures, because of which, whether we are religious believers or not, we need a sense of concern for others\xe2\x80\x99 well-being.'",12298,47049
1168818430662733824,2019-09-03 09:30:04,"b'I belong to the 20th century generation, while many of you belong to the 21st century. What\xe2\x80\x99s past is past, we can\xe2\x80\x99t change it, but we can learn from it. What is clear is that the future of humanity is in our hands.'",10463,45076
1167368997202845696,2019-08-30 09:30:32,b'Ours is a globalized world. Climate change affects us all; no one can hide from it. The global economy means we need to think of other people as members of one global family. This is why we need humane values based on common sense and common experience in our education systems.',16516,53895
1165919580545400832,2019-08-26 09:31:04,"b""When you have peace of mind, it's easier to cope with problems. Real change will come about not as a result of prayer, but of using intelligence and taking action.""",23295,71868
1164832363970359297,2019-08-23 09:30:51,"b'Science and technology has brought much development, and yet we still face many man-made problems. We are social animals. We depend on the community in which we live. Therefore, we need a sense of global responsibility, because the well-being of humanity is our own well-being.'",13384,42315
1163382648779112449,2019-08-19 09:30:12,"b""Reports of suffering are upsetting, but it's a mistake to think we can do nothing about it. Many problems we face are of our own making. Since we are social animals who need friends, the least we can do is smile and respond to others warm-heartedly\xe2\x80\x94that will make a difference.""",11064,41850
1162295468786798592,2019-08-16 09:30:08,"b'The more people learn to tackle their afflictive emotions, the more individuals will achieve peace of mind, and the more individuals achieve inner peace, the greater are the prospects for peace in the world.'",10716,36758
1160845974899585024,2019-08-12 09:30:22,"b'Seeing how negative emotions lead to negative consequences can help us overcome them. Just as we can learn how helpful love and compassion can be, we can come to understand that anger, pride, jealousy and arrogance can be detrimental. We need to use reason and human intelligence.'",17310,54858
1158309183139090432,2019-08-05 09:30:04,"b'Mentally and emotionally we humans are all the same. We can all feel anger and hatred, but also have the potential to cultivate compassion, forgiveness and tolerance. Since these constructive emotions are supported by reason, we can use our brains to develop and strengthen them.'",21764,72328
1157222101863940098,2019-08-02 09:30:23,"b'One of the lessons we need to learn is how to cultivate those positive emotions that counter destructive emotions like anger and fear. Compassion, for example, brings self-confidence and the ability to act transparently. It strengthens trust which is the ground for friendship.'",14066,43718
1156496755384446977,2019-07-31 09:28:07,"b""Healthy Competition - HHDL talks about how competition can be positive in answering a student's question during their meeting at his residence in Dharamsala, HP, India on July 31, 2019. https://t.co/6P5VTMDYju""",2061,8783
1155772482374078470,2019-07-29 09:30:07,"b'Young children don\xe2\x80\x99t care about differences of nationality, faith or race. So long as their companions smile, they play together happily. It seems it\xe2\x80\x99s only as we grow up, in the course of education, that focussing on secondary differences between people creates trouble.'",22136,73748
1154685852825505792,2019-07-26 09:32:14,"b'It\xe2\x80\x99s useful to reflect not only on how anger, fear and suspicion destroy our peace of mind, but also on how peace of mind gives us the confidence to act honestly and truthfully. We are social animals and we need friends. We make friends on the basis of trust.'",17582,57360
1153236018364993536,2019-07-22 09:31:07,"b'My dedication is to serve the 7 billion human beings on this planet and the other creatures with whom we share it. If you can, help and serve others, but if you can\xe2\x80\x99t at least don\xe2\x80\x99t harm them; then in the end you will feel no regret.'",16267,65587
1151786775100063744,2019-07-18 09:32:21,"b'How We Create Problems for Ourselves - HHDL talks about how human beings create problems for themselves during his meeting with medical students from Tulane University in the USA at his residence in Dharamsala, HP, India on July 17, 2019. https://t.co/YLo0liqiDD'",4575,15168
1150699235748143105,2019-07-15 09:30:51,"b""Reacting to Harm with Compassion - HHDL answers a young woman's question on how to be compassionate to those who do harm during their meeting at his residence in Dharamsala, India on July 12, 2019.""",745,4424
1150698869455331330,2019-07-15 09:29:24,b'https://t.co/mm8PYvGMZi',3936,15312
1149615095422394368,2019-07-12 09:42:52,"b""When you find that all human beings are just like you, it fosters a spirit of friendship. You\xe2\x80\x99ll find there's less need to hide things, and as a result, feelings of fear, self-doubt, and insecurity are automatically dispelled. What\xe2\x80\x99s more you\xe2\x80\x99ll earn the trust of other people.""",9376,31265
1148881307667034117,2019-07-10 09:07:03,b'HHDL sends his thanks for all the greetings he received on his birthday. https://t.co/pIVaEKrbU2 https://t.co/nq2GqVkQjB',1077,10465
1148162661101608960,2019-07-08 09:31:24,"b'Education needs to be combined with a sincere, compassionate motivation. When intelligence and warm-heartedness are combined, individuals will be happier and more at peace with themselves, their families will benefit and as a result the wider community will benefit too.'",13891,44682
1147437756139761664,2019-07-06 09:30:54,"b""The Best Birthday Gift - HHDL's message on his 84th birthday from his residence in Dharamsala, HP, India on July 6, 2019. https://t.co/Bc5wNwDSbC""",7535,31143
1147075332366671873,2019-07-05 09:30:45,"b'Compassion is concern for others\xe2\x80\x94sincere concern for others\xe2\x80\x99 well-being founded on awareness of our own experience. Since it makes us happy when others show us affection and offer us help, if we show others affection and readiness to help they too will feel joy.'",13290,43912
1146008853097488384,2019-07-02 10:52:57,b'Clarification and Context of Remarks Made by His Holiness the Dalai Lama in a Recent BBC Interview https://t.co/wxCKZ8GTSe https://t.co/S51tkATwu1',1359,6519
1144539294360432640,2019-06-28 09:33:26,"b'An effective means of teaching someone how to be more warm and compassionate is to use reasoning about the value and benefits of compassion, having them reflect on how they feel when someone is kind to them. This can prepare them to be warmer and more compassionate to others.'",11017,39758
1143088886760919040,2019-06-24 09:30:02,"b""Let\xe2\x80\x99s reflect on what gives meaning to our lives, and set our priorities on the basis of that. We need to be positive. We weren't born to cause trouble or to do harm to others. For life to be of value, we must develop basic good human qualities\xe2\x80\x94warmth, kindness, compassion.""",23313,64118
1142001765971140609,2019-06-21 09:30:13,"b'Genuine friendship is not based on money and power, but on trust, which in turn develops as a result of showing concern for other people\xe2\x80\x99s well-being. In other words, friendship is founded on warm-heartedness.'",23287,71565
1140552136549228544,2019-06-17 09:29:54,"b'Ideas may travel from the top down, but the movements that put them into effect have to work from the bottom up. I am encouraged to see young people trying to bring about positive change. Confident because their efforts are based on truth and reason\xe2\x80\x94therefore they will succeed.'",14094,51321
1139465137964720128,2019-06-14 09:30:33,"b'If you set out to cheat and deceive others you\xe2\x80\x99ll be tense and anxious in case you\xe2\x80\x99re found out. But if you live your life and conduct your business on the basis of truth and honesty, it gives you a sense of satisfaction and self-confidence that is also a source of inner strength'",27672,88476
1138377092679135232,2019-06-11 09:27:03,"b'Advice for Children - HHDL explains the importance of warm-heartedness and intelligence in answer to a question from a young girl at his residence in Dharamsala, HP, India on June 10, 2019. https://t.co/twsFVMQbuL'",6884,22453
1136928496230383616,2019-06-07 09:30:51,"b'Of the 7 billion human beings alive today, no one wants to suffer; no one chooses to have problems. Yet, many of the problems we face are our own creation. Why? Because of ignorance. But ignorance is not permanent and whether we overcome it depends on whether we make the effort.'",27519,86474
1135478752589127680,2019-06-03 09:30:05,"b'Compassion and concern for others are the key to human survival. People with no interest in religion sometimes disregard qualities like patience and compassion, which they associate with religious practice. In fact, they are relevant to anyone who wishes to live a happy life.'",15358,51211
1134390922328678400,2019-05-31 09:27:26,"b'Hope for Humanity - HHDL talks about how to counteract negative emotions by cultivating compassion in this short clip from a talk to Emory University students at his residence in Dharamsala, HP, India on May 31, 2019. https://t.co/J3HlqIvvQT'",5636,18230
1133304462511001600,2019-05-28 09:30:14,"b'How we view human nature can mean the difference between living in a world filled with people who are perceived as hostile, violent and dangerous, or as essentially kind, helpful and gentle. A deep awareness of the essential goodness of human beings can give us courage and hope.'",15561,52472
1131857220126162946,2019-05-24 09:39:24,b'Our life depends on others so much that at the root of our existence is a fundamental need for love. That is why it is good to cultivate an authentic sense of responsibility and concern for the welfare of others.',19745,62223
1130405349905686528,2019-05-20 09:30:11,"b'In our education system, we need to include lessons, like those concerning physical hygiene, that focus on mental and emotional hygiene, that teach how to develop a healthy mind. This is the core of what I call secular ethics.'",20347,72811
1129318179795111936,2019-05-17 09:30:10,"b'If you restrain from wrong-doing, people will see you as a friend and you\xe2\x80\x99ll be happy. When people are powerful and wealthy, but dishonest, people don\xe2\x80\x99t like them, even if they don\xe2\x80\x99t show it to their faces. If you do good, you\xe2\x80\x99ll have friends and when you\xe2\x80\x99re gone you\xe2\x80\x99ll be missed'",15780,59408
