id,created_at,text,retweets,favorites77675959196717056,2011-06-06 09:59:26,"b'HHDL interview on Ideas in Action, originally broadcast on PBS in the USA on June 2, 2011. http://youtu.be/9JWtUWjv-UE'",194,88
77310073155760128,2011-06-05 09:45:32,"b""HHDL greeting the audience at Tibetan Childrens' Village School (TCV) in Upper Dharamsala, India, on June 4, 2011. http://twitpic.com/57ae7t""",226,74
76942797621559296,2011-06-04 09:26:07,"b'By extending our ordinary feelings of love and concern beyond their usual biased limits, love is freed from the restrictions of attachment.'",3833,900
76580831338045440,2011-06-03 09:27:47,"b'We should value our enemies because they provide us with unique opportunities to practice patience, tolerance and forbearance.'",8750,2289
75858388856217600,2011-06-01 09:37:03,"b'HHDL live from TCV, Dharamsala, India - introduction to Buddhism for young Tibetans, June 3-4, 9-11:30amIST http://dalailama.com/liveweb'",230,95
75493559700176896,2011-05-31 09:27:21,"b""When I speak about love and compassion, I don't do so as a Buddhist, or a Tibetan, or as the Dalai Lama, but as one human being to another.""",5132,1109
75134594717978624,2011-05-30 09:40:57,"b'The most important thing is to have a sense of responsibility, commitment, and concern for each of our fellow human beings.'",5164,1060
74409526291480576,2011-05-28 09:39:48,"b""The world's major religious traditions all give the development of compassion a key role.""",1474,334
74041557111668736,2011-05-27 09:17:37,"b'When we wish to help others and try to do so, our attitude is more positive and relationships become easier.'",4673,917
73319302413025280,2011-05-25 09:27:38,"b'To arrive at certainty, you need to start from a skeptical posture. The best scientists are impartial, not swayed by their own beliefs.'",3591,853
72957809158930432,2011-05-24 09:31:11,b'Only through kindness and love can peace of mind be achieved.',5599,1161
72593731336945664,2011-05-23 09:24:28,"b'The quality of altruism is fundamental, in my opinion, and will fill our daily lives with serenity and happiness.'",1980,420
72226022900240384,2011-05-22 09:03:20,"b'HHDL greeting players before the Indian Premier League (IPL) cricket match in Dharamsala, India, on May 21, 2011.  http://twitpic.com/50zjg6'",212,56
71868462716305409,2011-05-21 09:22:31,"b'Kalachakra for World Peace  - HHDL will be in Washington DC, July 6-16 for empowerment, teachings & other events. http://dalaila.ma/jkkfEK'",271,63
71498780570161152,2011-05-20 08:53:32,"b'The aim of spiritual practice is to become the friend of all beings, concerned about them and ready and able to help them.'",3295,811
71145518478262272,2011-05-19 09:29:48,"b'HHDL recalls his early childhood in this clip from his talk at the University of Minnesota on May 8, 2011.  http://youtu.be/_zln3n27ZdY'",233,109
70786187752771584,2011-05-18 09:41:56,"b'We need to think of each other as true brothers and sisters, concerned for each other\xe2\x80\x99s welfare.'",3724,655
70422792994172928,2011-05-17 09:37:56,"b'Reliable and genuine discipline comes not from repression, but from an understanding of all the whys and wherefores of our actions.'",3626,995
70057132661293056,2011-05-16 09:24:56,"b'Love and compassion benefit both ourselves and others. Through kindness to others, your heart and mind will be peaceful and open.'",7125,1395
69336899931746304,2011-05-14 09:42:59,"b'In situations that are difficult and challenging, patience helps maintain your will power and can sustain you.'",5882,1421
68976035336691712,2011-05-13 09:49:02,"b'Rather than working only to acquire wealth, we need to focus on the welfare of humanity as a whole.'",4454,835
68611571596795905,2011-05-12 09:40:48,"b""Compassion is a sense of caring, a sense of concern for others' well-being.""",2912,576
68540802212700160,2011-05-12 04:59:35,"b'HHDL to lead Newark Peace Summit in Newark, NJ, (USA) May 13-14th 2011. 3 Day conference on power of non-violence. http://bit.ly/eN4PWG'",303,39
68248034684833792,2011-05-11 09:36:14,"b'When our intentions are good, we are stronger and have greater self-confidence.'",6130,1349
68124782364864512,2011-05-11 01:26:28,"b'Watch HHDL live from the University of Arkansas, USA, on May 11 at  9:30am and at 1:30pm CDT. http://globalcampus.uark.edu/HHDL/'",292,61
67885958485381120,2011-05-10 09:37:28,"b'HHDL holds his Doctor of Humane Letters honorary degree presented by Southern Methodist University on May 9, 2011  http://twitpic.com/4vt97v'",209,49
67795880010448896,2011-05-10 03:39:32,"b'Watch HHDL\'s talk ""Secular Ethics, Human Values and Society"" given at USC in Los Angeles on May 3, 2011. http://youtu.be/t_TwSx0520c'",313,153
67523598432219137,2011-05-09 09:37:35,b'A holistic view brings realistic action.',2166,488
66802765724262400,2011-05-07 09:53:15,b'Compassion and love constitute non-violence in action.',2977,518
66434760892874752,2011-05-06 09:30:55,"b'Live: HHDL in Minnesota, USA. Press conference, Tibetan audience and dialogue May 7. Teaching and talk May 8. http://dalailama.com/liveweb'",198,45
66084495912210432,2011-05-05 10:19:06,"b'I think human nature is basically good: though we have jealousy and hatred, our dominant characteristics seem to be affection and kindness.'",4797,1042
65708457487118336,2011-05-04 09:24:51,b'The ultimate source of a happy life is the attention we pay to our inner values.',5177,1260
65344936781955072,2011-05-03 09:20:21,b'Live: May 4th HHDL from California - Amnesty International Award at 10am & public talk at UC Irvine at 1:30pm http://dalailama.com/liveweb',237,52
64986493327912960,2011-05-02 09:36:02,"b'To have true friends and be loved by them, we must in turn feel love and sympathy for others.'",5040,1069
64553498833985536,2011-05-01 04:55:28,"b""Change in HHDL's schedule in California and will now arrive on May 2nd, we regret inconvenience to all concerned. http://bit.ly/mzMHMS""",174,43
64263561739907073,2011-04-30 09:43:21,"b'Live: HHDL from Southern California, USA. Long Beach on May 1st at 2:30pm & UCLA on May 2nd at 10am and 1.30pm. http://dalailama.com/liveweb'",236,56
63920787370938369,2011-04-29 11:01:17,"b""HHDL joins in prayers for victims of last month's earthquake in Japan at Gokokuji Temple in Tokyo, on April 29th.  http://twitpic.com/4qxakc""",974,157
63542846661206016,2011-04-28 09:59:29,"b'Better grounded emotionally through patience, we become stronger mentally and spiritually, and tend to be healthier physically.'",3689,914
63176845734051840,2011-04-27 09:45:08,"b'Compassion and love are the source of all spiritual qualities: forgiveness, tolerance, all the virtues.'",3884,891
62815809877192704,2011-04-26 09:50:30,"b'HHDL joins in prayers in Dharamsala, India, on April 26th, for victims of the ongoing repression in Tibet.         http://twitpic.com/4pouxk'",423,70
62453396669612032,2011-04-25 09:50:24,"b'I am saddened by the passing away of Sri Sathya Sai Baba. I offer my condolences and prayers to all his followers, devotees and admirers.'",1104,186
61728263894073344,2011-04-23 09:48:59,"b'From the first day of our life until our last breath, the very foundation of our existence is affection and human warmth.'",5708,1399
61363282690322432,2011-04-22 09:38:41,"b'Monks in traditional dress with HHDL during a long life ceremony held in Dharamsala, India, on April 22nd, 2011.   http://twitpic.com/4nxc0t'",397,107
60999277845020672,2011-04-21 09:32:15,b'Developing love and compassion and reducing anger and spite is a universal activity which requires no faith in any religion whatsoever.',9208,1885
60638524671672321,2011-04-20 09:38:45,b'We must recognize the great capacity we all have within.',4224,900
60272096445603840,2011-04-19 09:22:42,"b'When we develop patience, we find that we develop a reserve of calm and tranquility.'",4193,1034
59910133597208576,2011-04-18 09:24:23,"b'When we are open to others and ready to show them our friendship and affection, this immediately creates a good environment.'",4230,902
59555266005450752,2011-04-17 09:54:16,"b'No matter what our situation, we all share the same aspiration for happiness.'",5562,1028
59106523581906945,2011-04-16 04:11:08,"b'Appeal by His Holiness the Dalai Lama expressing concern on the situation at Kirti Monastery, Ngaba, northeastern Tibet http://bit.ly/fFDfYY'",772,102
58826105523683329,2011-04-15 09:36:51,b'Human nature is such that the individual is most happy and relaxed when he or she can share happiness and trust with others.',5456,1137
58466607764209666,2011-04-14 09:48:20,"b""Live webcast: HHDL's public talk  from Lund, Sweden, on April 16th, 1:45pm (GMT+2Hours). http://www.dalailamalive.com""",252,63
58096939413147648,2011-04-13 09:19:24,"b'HHDL is greeted with a traditional Tibetan welcome on his arrival at his hotel in Dublin, Ireland, on April 12th.  http://twitpic.com/4kaiyf'",322,59
57743870716428288,2011-04-12 09:56:26,"b'If we make a steady effort, I think we can overcome any form of negative conditioning and make positive changes in our lives.'",5564,1299
57393498181222400,2011-04-11 10:44:10,b'HHDL live from Ireland - April 13 Dublin 9:45am (GMT+1) & Kildare 1:45. April 14 University of Limerick 9:20am. http://dalailama.com/liveweb',242,45
56288723838570496,2011-04-08 09:34:12,b'Compassion and love give meaning to our activities and makes them constructive.',4265,799
55926843311792128,2011-04-07 09:36:13,"b'Reflect on the value of inner versus outer wealth; in our world, there is a new awareness of our inner life and its worth.'",2938,622
55571747130458112,2011-04-06 10:05:11,"b'HHDL is greeted in traditional manner at the Maharaja Sansar Chand Museum inauguration in Kangra, India on April 6 http://twitpic.com/4hj9op'",146,49
55200510147436544,2011-04-05 09:30:01,"b'When patience is combined with the ability to discriminate between the action and the one who does it, forgiveness arises naturally.'",3876,994
54839796442476544,2011-04-04 09:36:41,"b'As human beings, we are all the same, there is no need to build some kind of artificial barrier between us.'",5832,1140
54127959757438977,2011-04-02 10:28:05,"b'HHDL enjoys a moment with one of the youngsters who performed before his address in New Delhi, India on April 2nd. http://twitpic.com/4g11zb'",264,68
53749702616825857,2011-04-01 09:25:02,"b'It is very important to generate a good attitude, a good heart, as much as possible.'",5006,1017
53388216493031425,2011-03-31 09:28:37,"b'Even without a religious perspective, love and compassion are clearly of fundamental importance to us all.'",5075,947
53028343204941824,2011-03-30 09:38:36,"b'Alongside our natural ability to empathize with others, we also have a need for others\xe2\x80\x99 kindness.'",2857,504
52301239186239488,2011-03-28 09:29:21,"b'Due to the fundamental interconnectedness that lies at the heart of reality, your interest is also my interest.'",2847,695
51570715354349568,2011-03-26 09:06:31,b'The enhancement of fundamental values is indispensable to our basic quest for happiness.',2283,480
51215504009998336,2011-03-25 09:35:02,b'HHDL talks about unbiased compassion during a Q&A session with Thai Buddhists in Dharamsala on March 15th. http://youtu.be/ThgZpUlvgqY',259,62
50854767626428416,2011-03-24 09:41:36,b'Overcoming negative tendencies and enhancing positive potential are the very essence of the spiritual path.',4576,1088
50493667445714945,2011-03-23 09:46:43,b'Every individual is responsible to help guide our global family in the right direction.',3454,626
50127402763952128,2011-03-22 09:31:18,b'Developing altruism is one of the most powerful methods for countering negative tendencies and destructive impulses.',2582,642
49765514750328832,2011-03-21 09:33:17,"b'All ethical teachings, whether religious or nonreligious, aim to nurture compassion, to develop it and to perfect it.'",2314,470
49051589859745792,2011-03-19 10:16:25,"b'HHDL arriving at the Main Tibetan Temple in Dharamsala, India, to give teachings on the ""Jataka Tales"" on March 19 http://twitpic.com/4azds9'",285,71
48690049025441792,2011-03-18 10:19:46,b'One of the best ways to begin familiarizing ourselves with the virtue of patience is to reflect systematically on its benefits.',2577,572
48325392267882496,2011-03-17 10:10:46,"b'Live: HHDL teaches from the ""Jataka Tales"" (Life Stories of the Buddha) March 19th at 8:00am IndianStandardTime http://dalailama.com/liveweb'",239,81
47967221720432641,2011-03-16 10:27:31,"b'It is necessary to help others, not only in our prayers, but in our daily lives.'",6262,988
47606755320004609,2011-03-15 10:35:09,"b'Cultivating a close, warmhearted feeling for others is the ultimate source of success in life.'",3590,820
47237561109856256,2011-03-14 10:08:06,"b'As well as restraining ourselves from negative thoughts and emotions, we need to cultivate and reinforce our positive qualities.'",5232,1092
46856548722544640,2011-03-13 08:54:06,"b'Live: HHDL teaches on ""37 Practices of a Bodhisattva"" & ""Middling Stages"" from Dharamsala, India on March 14-15 http://dalailama.com/liveweb'",265,110
46499964238565376,2011-03-12 09:17:10,b'His Holiness the Dalai Lama Expresses His Sadness Over the Recent Earthquake and Tsunami in Japan http://bit.ly/e4lZsW',1814,282
45760714983489536,2011-03-10 08:19:39,b'Statement of His Holiness the Dalai Lama on the 52nd Anniversary of the Tibetan National Uprising Day http://bit.ly/fO7i8R',959,177
45421202180800513,2011-03-09 09:50:33,"b'Live from Dharamsala: 52nd Anniversary of the Tibetan National Uprising Day, March 10, 9am IndianStandardTime http://dalailama.com/liveweb'",476,55
44692602649460736,2011-03-07 09:35:21,b'Altruism means that we should not be exclusively preoccupied with our own welfare. This does not imply that one should become a martyr!',3141,719
42885095987744768,2011-03-02 09:52:58,"b'It seems essential to me that the major religions come to agree upon the importance of adopting a basic, universal, set of ethics.'",2887,649
42160750948651008,2011-02-28 09:54:40,"b'As we develop more love for others, we\xe2\x80\x99ll have more confidence in ourselves; the more courage we have, the more relaxed and serene we\xe2\x80\x99ll be.'",5614,1452
41069908137611264,2011-02-25 09:40:03,"b'If our spirit is turned towards kindness, the positive side of things, loving our neighbors, this is the best way to solve our problems.'",4092,828
40698097973600256,2011-02-24 09:02:37,"b'His Holiness the Dalai Lama expresses his sadness over the recent earthquake in Christchurch, New Zeland.http://bit.ly/hg0gfx'",647,104
40342246217752576,2011-02-23 09:28:35,"b'If we want to help humanity in a practical way, we must begin by setting an example of mutual respect, harmony and cooperation.'",4261,788
39999970065129473,2011-02-22 10:48:30,b'Developing altruism is one of the most powerful methods for countering negative tendencies and destructive impulses.',2369,595
39619916743184384,2011-02-21 09:38:18,"b'To promote the idea of nonviolence, we must above all encourage people to foster in themselves an attitude of love and affection for others.'",3074,519
39255845367709696,2011-02-20 09:31:37,"b'HHDL with Mumbai University students and staff after his talk ""Ancient Wisdom, Modern Thought"" on February 18th.   http://twitpic.com/41sits'",220,71
38893727430746112,2011-02-19 09:32:41,b'Large human movements spring from individual human initiatives.',3269,627
38536640511225856,2011-02-18 09:53:45,b'We cannot be loving and compassionate unless at the same time we curb our own harmful impulses and desires.',2967,783
38156864436973568,2011-02-17 08:44:40,b'Our body needs peace of mind and is not suited to agitation. This shows that an appreciation for peace of mind is in our blood.',3039,711
37827795308658688,2011-02-16 10:57:03,"b'Friends and enemies do not exist as such; friendship and enmity depend on many factors, of which the primary one is our own mental attitude.'",3740,885
37460130870067200,2011-02-15 10:36:05,b'In general I think that anger is a sign of weakness and tolerance a sign of strength.',7713,2038
37079950171312129,2011-02-14 09:25:23,"b'One may practice religion or not, but so long as we seek happiness and continue to live in society, love and affection are indispensable'",3367,784
36367390593785856,2011-02-12 10:13:56,b'I would like to say that the very root of respect for human rights and nonviolence is love and kindness to others',4193,752
35297063986012160,2011-02-09 11:20:50,"b'While the mind is untamed it can only cause trouble. If anger, greed or arrogance spring up they will take over the situation.'",3920,974
34168819769409536,2011-02-06 08:37:36,"b'HHDL reaching out to shake hands with Indian Buddhists at Ganden Monastery in Mundgod, India, February 5th, 2011.  http://twitpic.com/3x14ak'",290,80
33810231972597760,2011-02-05 08:52:42,"b'In our daily life, tolerance and patience have great benefits: developing them will allow us to sustain and maintain our presence of mind.'",4421,1059
33456037105242112,2011-02-04 09:25:15,"b""We can't be useful to ourselves unless we're useful to others.""",4372,952
33062952307269633,2011-02-03 07:23:16,"b'The whole purpose of engaging in the practice of patience is to become stronger in mind, stronger in heart.'",4428,1239
32740237071355904,2011-02-02 10:00:55,"b'It is not enough simply to wish that love and compassion should increase in us, we need to make a sustained effort to cultivate them.'",3868,832
32376713878966273,2011-02-01 09:56:24,b'The aim of spiritual and therefore ethical practice is to transform and perfect the individual\xe2\x80\x99s motivation and mental disposition.',1583,438
32148311838298112,2011-01-31 18:48:49,"b""Live Audio Webcast: HHDL's teaching from Drepung Monastery in South India, Feb 1-2, 9-11am IndianStandardTime http://dalailama.com/liveweb""",242,67
32034688742727680,2011-01-31 11:17:19,"b'HHDL watching students debate during their examinations at Rato Monastery in Mundgod, India, on January 31, 2011.  http://twitpic.com/3v4t8b'",189,55
31658210456772609,2011-01-30 10:21:20,"b'Cultivating a close, warm-hearted feeling for others automatically puts our mind at ease.'",2420,573
31304895499870209,2011-01-29 10:57:23,"b'The more we succeed in training our hearts and minds through cultivating spiritual qualities, the better our ability to cope with adversity.'",3211,806
30881990978838531,2011-01-28 06:56:55,"b""Live: HHDL's talk Finding Happiness in Troubled Times, Bangalore, India on Jan 30, 2:30-4pm IndianStandardTime http://dalailama.com/liveweb""",273,78
30548473782738946,2011-01-27 08:51:38,"b'When we are motivated by wisdom and compassion, the results of our actions benefit everyone.'",4206,892
30209830304096256,2011-01-26 10:25:59,"b'Genuine love should first be directed at oneself \xe2\x80\x93 if we do not love ourselves, how can we love others?'",6110,1471
29497317459492864,2011-01-24 11:14:43,b'We need a genuine sense of responsibility and a sincere concern for the welfare of others.',3000,556
28749840091447296,2011-01-22 09:44:30,b'Because our own human existence is so dependent on the help of others our need for love lies at the very foundation of our existence.',4204,1021
28399370130952192,2011-01-21 10:31:52,"b'An affectionate disposition not only makes the mind more peaceful and calm, but it affects our body in a positive way too.'",3004,657
28139369965559808,2011-01-20 17:18:43,"b'Transcript of the video conference with His Holiness the Dalai Lama and Chinese Activists held on January 4th, 2011. http://bit.ly/gbm2Qm'",245,69
27670143928635392,2011-01-19 10:14:11,b'Mutual respect is the foundation of genuine harmony.',4274,905
27302142574338048,2011-01-18 09:51:52,"b'By going beyond your own problems and taking care of others, you gain inner strength, self-confidence, courage, and a greater sense of calm.'",4997,1400
26941573090508800,2011-01-17 09:59:06,"b'With the realization of ones own potential and self-confidence in ones ability, one can build a better world.'",3026,828
26593220930572288,2011-01-16 10:54:52,"b'Photo of HHDL waving to the audience before his teachings in Sarnath, India, on January 15th, 2011.                http://twitpic.com/3qjsiv'",272,67
26202902133481472,2011-01-15 09:03:53,"b'If we have a positive mental attitude, then even when surrounded by hostility, we shall not lack inner peace.'",5523,1501
26137590868480000,2011-01-15 04:44:21,"b""Watch HHDL's talk to westerners attending the teachings in Sarnath, India, on January 13th, 2011. http://youtu.be/H0wIxrxatSE""",180,72
25906390383992832,2011-01-14 13:25:39,b'His Holiness the Dalai Lama offers his condolences to those affected by the floods in Brazil. http://bit.ly/i2xIcB',832,68
25857113393729536,2011-01-14 10:09:50,"b'If we develop a good heart, then whether the field is science, agriculture or politics, since motivation is important these will all improve'",1653,366
25443089720020993,2011-01-13 06:44:39,"b'His Holiness the Dalai Lama Expresses his Sadness Over the Recent Floods in Queensland, Australia. http://bit.ly/h4sUxB'",696,87
25132897606303746,2011-01-12 10:12:04,"b'The purpose of our life needs to be positive. We weren\xe2\x80\x99t born with the purpose of causing trouble, harming others.'",5712,1222
24764990611263488,2011-01-11 09:50:08,b'It is my fundamental conviction that compassion constitutes a basic aspect of our nature as well as being the foundation of our happiness.',2131,465
24741543852113920,2011-01-11 08:16:58,"b'Live: HHDL teaches Shantideva\xe2\x80\x99s Guide and Kamalashila\xe2\x80\x99s Middle Stages from Sarnath, India, on Jan 12-16, 2011. http://dalailama.com/liveweb'",135,48
24425786345791488,2011-01-10 11:22:15,b'We cannot overcome anger and hatred simply by suppressing them. We need to actively cultivate the antidotes: patience and tolerance.',5766,1308
23320685443031040,2011-01-07 10:10:59,b'Happiness does not come about only due to external circumstances; it mainly derives from inner attitudes.',6245,1521
23221781615611905,2011-01-07 03:37:58,"b'Photo of HHDL taking part in his first video conference with 3 prominent Chinese intellectuals on January 4, 2011. http://twitpic.com/3novoy'",524,122
22732859273904128,2011-01-05 19:15:10,"b'Essay by HHDL ""Countering Stress and Depression"" originally published by Hindustan Times, India, on January 3rd, 2011. http://bit.ly/ha5KCn'",672,375
22601111475060737,2011-01-05 10:31:39,"b'I feel that the moment you adopt a sense of caring for others, it brings you inner strength.'",3552,862
22233184938754049,2011-01-04 10:09:39,"b'To increase our altruism, we must motivate ourselves to take into consideration the effects of our actions both in the present and future.'",2192,535
21886751542870016,2011-01-03 11:13:02,b'Determination and hope are key factors for a brighter future.',4804,1075
20795871448797184,2010-12-31 10:58:16,b'Awareness of impermanence and appreciation of our human potential will give us a sense of urgency that we must use every precious moment.',2941,800
20423128056332288,2010-12-30 10:17:07,"b""A skillful, balanced approach is helpful for one's physical and emotional health, and it applies to one's spiritual growth as well.""",1803,494
20061947403698176,2010-12-29 10:21:55,"b'As I see it, compassion is the essence of a spiritual life.'",2272,505
20046919149559808,2010-12-29 09:22:12,"b""Optimism in the Face of Adversity, a clip from HHDL's talk with students in Sikkim, India, on December 21, 2010. http://youtu.be/_IjCZhlXxkI""",380,164
19335233497210880,2010-12-27 10:14:13,"b'If you want others to be happy, practice compassion. If you want to be happy, practice compassion.'",4755,1179
18971992745058304,2010-12-26 10:10:50,"b'In order to create a happy century, a peaceful century we must promote the concept of dialogue.'",2389,427
18249616508067840,2010-12-24 10:20:22,"b'It is clear that feelings of love, affection, closeness and compassion bring happiness.'",3903,759
17890073617895424,2010-12-23 10:31:40,"b'I believe that our underlying or fundamental nature is gentleness, and intelligence is a later development.'",880,264
17528344002166784,2010-12-22 10:34:17,b'I think that cultivating positive mental states like kindness and compassion definitely leads to better psychological health and happiness.',2630,565
17161122146689024,2010-12-21 10:15:05,b'Achieving genuine happiness may require bringing about a transformation in your outlook and way of thinking.',3586,871
17088731836063746,2010-12-21 05:27:25,"b'HHDL addresses the Science, Spirituality and Education conference in Sikkim, India on December 20th, 2010. http://youtu.be/ANS7Nc2B2ec'",215,81
16798701888475136,2010-12-20 10:14:57,"b'Compassion creates a positive, friendly atmosphere.'",2388,459
16441954963300353,2010-12-19 10:37:22,b'I believe a proper use of our time is to serve others if we can or at least refrain from harming them. That is the basis of my philosophy.',3198,789
16077244715769856,2010-12-18 10:28:08,b'Within all beings there is a seed of perfection; but compassion is required to activate that seed inherent in our hearts and minds.',2621,619
15346180774957056,2010-12-16 10:03:09,"b'Not only do we inherently possess the potential for compassion but I believe that the basic, underlying nature of human beings is gentleness'",2061,413
14990127185010688,2010-12-15 10:28:19,"b'At one level, all major religious traditions have the same aim \xe2\x80\x93 to transform the individual into a positive being.'",3061,699
14946052167700480,2010-12-15 07:33:11,"b'HHDL clarifies his statements on retirement during a press meeting in Kalimpong, India, on December 14th, 2010. http://youtu.be/7PIEJfbgQ14'",160,60
